{
  "spec_version": "2.0.0",
  "report_schema_version": "2.0.0",
  "analyzer_mode": "hybrid",
  "fallback_policy": "fail-open",
  "min_severity": "low",
  "format": "console",
  "output": null,
  "stdout": false,
  "progress": false,
  "incremental": false,
  "diff_from": null,
  "cache_path": null,
  "no_cache_write": false,
  "policy_scope": "all_findings",
  "baseline_required": false,
  "require_authoritative": false,
  "require_trusted_incremental": false,
  "policy_profile": null,
  "secret_scan_enabled": false,
  "secret_entropy_threshold": 4.5,
  "secret_min_token_length": 20,
  "secret_max_file_bytes": 1048576,
  "dependency_scan_enabled": false,
  "dependency_advisory_file": null,
  "dependency_policy_file": null,
  "dependency_max_file_bytes": 2097152,
  "error_format": "text",
  "exit_zero_on_findings": false,
  "fail_on": "high",
  "min_confidence": 0.0,
  "min_confidence_level": null,
  "include": [],
  "exclude": [],
  "respect_gitignore": true,
  "use_default_excludes": true,
  "enable": [],
  "policy_file": null,
  "baseline_file": null,
  "ruleset_version": "core-2.0.0"
}
